title,genre,wiki_plot_clean
The Godfather,Crime  Drama,day daughter wedding vito corleone hears request role godfather new york crime family vitos youngest son michael marine corp uniform introduces girlfriend kay adam family sprawling reception vitos godson johnny fontane popular singer pleads help securing coveted movie role vito dispatch consigliere tom hagen los angeles influence abrasive studio head jack woltz woltz unmoved morning wake bed severed head prized stallion day daughter wedding vito corleone vito corleone hears request role godfather new york crime family vitos youngest son michael michael marine corp marine corp uniform introduces girlfriend kay adam kay adam family sprawling reception vitos godson johnny fontane johnny fontane popular singer pleads help securing coveted movie role vito dispatch consigliere consigliere tom hagen tom hagen los angeles influence abrasive studio head jack woltz jack woltz woltz unmoved morning wake bed severed head prized stallion stallion shortly christmas drug baron virgil turk sollozzo backed corleones rival tattaglias asks vito investment emerging drug trade protection political connection vito disapproves drug dealer sends enforcer luca brasi spy family receives two fish wrapped brasis vest imparting sleep fish assassination attempt sollozzos men land vito hospital eldest son sonny take command sollozzo kidnaps hagen pressure sonny accept deal michael thwart second assassination attempt father hospital jaw broken police captain mccluskey also sollozzos bodyguard sonny retaliates attack father tattaglias son killed michael come plan hit sollozzo mccluskey pretext settling dispute michael accepts offer meet bronx restaurant retrieving planted handgun murder shortly christmas drug baron virgil turk sollozzo virgil turk sollozzo backed corleones rival tattaglias asks vito investment emerging drug trade protection political connection vito disapproves drug dealer sends enforcer luca brasi luca brasi spy family receives two fish wrapped brasis vest imparting sleep fish assassination attempt sollozzos men land vito hospital eldest son sonny sonny take command sollozzo kidnaps hagen pressure sonny accept deal michael thwart second assassination attempt father hospital jaw broken police captain mccluskey also sollozzos bodyguard sonny retaliates attack father tattaglias son killed michael come plan hit sollozzo mccluskey pretext settling dispute michael accepts offer meet bronx restaurant retrieving planted handgun murder despite clampdown authority five family erupt open warfare brother fear safety michael take refuge sicily fredo corleone sheltered associate moe greene la vega sonny attack brotherinlaw carlo street abusing sister connie threatens kill abuse happens sonny speed home assassin ambush highway toll booth riddle submachine gun fire michael time abroad led marriage apollonia vitellus euphoria shattered car bomb intended take life despite clampdown authority five family five family erupt open warfare brother fear safety michael take refuge sicily fredo corleone fredo corleone sheltered associate moe greene moe greene la vega la vega sonny attack brotherinlaw carlo carlo street abusing sister connie threatens kill abuse happens sonny speed home assassin ambush highway toll booth riddle submachine gun fire michael time abroad led marriage apollonia vitellus euphoria shattered car bomb intended take life devastated sonny death vito decides end feud realising tattaglias order dominant emilio barzini promise head five family withdraw opposition heroin business forgo revenge son murder safety guaranteed michael return home father saddened involvement family business marries kay next year devastated sonny death vito decides end feud realising tattaglias order dominant emilio barzini emilio barzini promise head five family withdraw opposition heroin business forgo revenge son murder safety guaranteed michael return home father saddened involvement family business marries kay next year father end career surviving brother weak michael take rein family promising kay make business legitimate within five year end insists hagen relocate la vega relinquish role vito tom wartime consigliere older man agrees tom part happen coming battle rival family michael travel la vega buy greene stake family casino greene derides corleones fading power add injury insult michael see fredo falling greene sway father end career surviving brother weak michael take rein family promising kay make business legitimate within five year end insists hagen relocate la vega relinquish role vito tom wartime consigliere older man agrees tom part happen coming battle rival family michael travel la vega buy greene stake family casino greene derides corleones fading power add injury insult michael see fredo falling greene sway vito collapse dy garden playing michael son anthony funeral salvatore tessio arranges meeting michael barzini signalling treachery vito warned meeting set day christening connies son michael stand godfather christening proceeds corleone assassin acting michael order murder new york don moe greene tessio told michael aware betrayal taken death carlo questioned michael involvement setting sonny murder confesses contacted barzini peter clemenza kill wire garrote michael confronted connie accuses husband killed denies killing carlo questioned kay answer accepts kay watch warily michael receives capo address new corleone vito collapse dy garden playing michael son anthony anthony funeral salvatore tessio salvatore tessio arranges meeting michael barzini signalling treachery vito warned meeting set day christening connies son michael stand godfather christening proceeds corleone assassin acting michael order murder new york don moe greene tessio told michael aware betrayal taken death carlo questioned michael involvement setting sonny murder confesses contacted barzini peter clemenza peter clemenza kill wire garrote garrote michael confronted connie accuses husband killed denies killing carlo questioned kay answer accepts kay watch warily michael receives capo capo address new corleone
The Shawshank Redemption,Crime  Drama,banker andy dufresne convicted murdering wife lover sentenced two consecutive life sentence fictional shawshank state penitentiary state maine andy befriends contraband smuggler elli red redding inmate serving life sentence red procures rock hammer later large poster rita hayworth andy working prison laundry andy regularly assaulted bull queer gang sister leader bog banker andy dufresne convicted murdering wife lover sentenced two consecutive life sentence fictional shawshank state penitentiary state maine andy befriends contraband contraband smuggler elli red redding inmate serving life sentence red procures rock hammer rock hammer later large poster rita hayworth rita hayworth andy working prison laundry andy regularly assaulted bull queer bull queer gang sister leader bog andy overhears brutal captain guard byron hadley complaining taxed inheritance offer help legally shelter money vicious assault sister nearly kill andy hadley beat bog severely bog sent another prison andy never attacked warden samuel norton meet andy reassigns prison library assist elderly inmate brook hatlen andys new job pretext begin managing financial matter prison employee time pass warden begin using andy handle matter variety people including guard prison warden andy begin writing weekly letter state government fund improve decaying library andy overhears brutal captain guard byron hadley complaining taxed inheritance offer help legally shelter money vicious assault sister nearly kill andy hadley beat bog severely bog sent another prison andy never attacked warden samuel norton meet andy reassigns prison library assist elderly inmate brook hatlen andys new job pretext begin managing financial matter prison employee time pass warden begin using andy handle matter variety people including guard prison warden andy begin writing weekly letter state government fund improve decaying library brook paroled adjust outside world fifty year prison hang andy receives library donation includes recording marriage figaro play excerpt public address system resulting receiving solitary confinement release solitary andy explains hope get time concept red dismisses norton begin exploiting prison labor public work profiting undercutting skilled labor cost receiving kickback andy launder money using alias randall stephen brook paroled paroled adjust outside world fifty year prison hang hang andy receives library donation includes recording marriage figaro marriage figaro marriage figaro play excerpt excerpt public address system resulting receiving solitary confinement solitary confinement release solitary andy explains hope get time concept red dismisses norton begin exploiting prison labor public work profiting undercutting skilled labor cost receiving kickback kickback andy launder launder money using alias randall stephen tommy williams incarcerated burglary join andys red circle friend andy help pas ged exam tommy reveals red andy inmate another prison claimed responsibility murder andy convicted implying andys innocence andy approach warden norton information warden refuse listen sends andy back solitary mention money laundering norton captain hadley murder tommy guise escape attempt andy refuse continue money laundering relents norton threatens burn library remove andys protection guard move cell worse condition andy released solitary confinement tell red dream living zihuatanejo mexican coastal town red feel andy unrealistic promise andy ever released visit specific hayfield near buxton maine retrieve package andy buried red becomes worried andys state mind especially learns andy asked another inmate supply six foot rope tommy williams incarcerated burglary burglary join andys red circle friend andy help pas ged ged exam tommy reveals red andy inmate another prison claimed responsibility murder andy convicted implying andys innocence andy approach warden norton information warden refuse listen sends andy back solitary mention money laundering norton captain hadley murder tommy guise escape attempt andy refuse continue money laundering relents norton threatens burn library remove andys protection guard move cell worse condition andy released solitary confinement tell red dream living zihuatanejo zihuatanejo mexican coastal town red feel andy unrealistic promise andy ever released visit specific hayfield near buxton maine buxton maine retrieve package andy buried red becomes worried andys state mind especially learns andy asked another inmate supply six foot rope next day roll call guard find andys cell empty irate warden norton throw rock poster raquel welch hanging wall rock tear poster removing poster warden discovers tunnel andy dug rock hammer previous two decade previous night andy escaped tunnel used prison sewage pipe reach freedom andy escape nortons suit shoe ledger containing detail money laundering guard search following morning andy pose randall stephen visit several bank withdraw laundered money finally mail ledger evidence corruption murder shawshank local newspaper police arrive shawshank take hadley custody norton commits suicide avoid arrest next day roll call roll call guard find andys cell empty irate warden norton throw rock poster raquel welch raquel welch hanging wall rock tear poster removing poster warden discovers tunnel andy dug rock hammer previous two decade previous night andy escaped tunnel used prison sewage pipe reach freedom andy escape nortons suit shoe ledger containing detail money laundering guard search following morning andy pose randall stephen visit several bank withdraw laundered money finally mail ledger evidence corruption murder shawshank local newspaper police arrive shawshank take hadley custody norton commits suicide avoid arrest serving year red finally paroled struggle adapt life outside prison fear never remembering promise andy visit buxton find cache containing money letter asking come zihuatanejo red violates parole travel fort hancock texas cross border mexico admitting finally feel hope beach zihuatanejo find andy two friend happily reunited serving year red finally paroled struggle adapt life outside prison fear never remembering promise andy visit buxton find cache containing money letter asking come zihuatanejo red violates parole travel fort hancock texas fort hancock texas cross border mexico admitting finally feel hope beach zihuatanejo find andy two friend happily reunited
Schindler's List,Biography  Drama  History,german move polish jew kraków ghetto world war ii begin oskar schindler ethnic german arrives city hoping make fortune member nazi party schindler lavishes bribe wehrmacht german armed force s official acquires factory produce enamelware help run business schindler enlists aid itzhak stern local jewish official contact black marketeers jewish business community stern help schindler arrange loan finance factory schindler maintains friendly relation nazi enjoys wealth status herr direktor stern handle administration schindler hire jewish worker cost less stern ensures many people possible deemed essential german war effort save transported concentration camp killed german move polish jew polish jew kraków ghetto kraków ghetto world war ii world war ii begin oskar schindler oskar schindler ethnic german ethnic german arrives city hoping make fortune member nazi party nazi party schindler lavishes bribe wehrmacht wehrmacht german armed force s s official acquires factory produce enamelware enamelware help run business schindler enlists aid itzhak stern itzhak stern local jewish official contact black marketeers black marketeers jewish business community stern help schindler arrange loan finance factory schindler maintains friendly relation nazi enjoys wealth status herr direktor stern handle administration schindler hire jewish worker cost less stern ensures many people possible deemed essential german war effort save transported concentration camp killed ssuntersturmführer second lieutenant amon goeth arrives kraków oversee construction płaszów concentration camp camp completed order ghetto liquidated many people shot killed process emptying ghetto schindler witness massacre profoundly affected particularly notice tiny girl red coat one splash color blackandwhite film hide nazi later see red coat wagon loaded body taken away burned know girl dead schindler careful maintain friendship goeth bribery lavish gift continues enjoy s support goeth brutally mistreats maid randomly shoot people balcony villa prisoner constant daily fear life time pass schindlers focus shift making money trying save many life possible bribe goeth allowing build subcamp worker better protect s untersturmführer untersturmführer untersturmführer second lieutenant amon goeth amon goeth arrives kraków oversee construction płaszów concentration camp płaszów concentration camp camp completed order ghetto liquidated many people shot killed process emptying ghetto schindler witness massacre profoundly affected particularly notice tiny girl red coat one splash color blackandwhite film hide nazi later see red coat wagon loaded body taken away burned know girl dead schindler careful maintain friendship goeth bribery lavish gift continues enjoy s support goeth brutally mistreats maid randomly shoot people balcony villa prisoner constant daily fear life time pass schindlers focus shift making money trying save many life possible bribe goeth allowing build subcamp worker better protect german begin lose war goeth ordered ship remaining jew płaszów auschwitz concentration camp schindler asks goeth allow move worker new munition factory plan build home town zwittaubrinnlitz goeth agrees charge huge bribe schindler stern create schindlers list list people transferred brinnlitz thus saved transport auschwitz german begin lose war goeth ordered ship remaining jew płaszów auschwitz concentration camp auschwitz concentration camp schindler asks goeth allow move worker new munition factory plan build home town zwittaubrinnlitz zwittaubrinnlitz goeth agrees charge huge bribe schindler stern create schindlers list list people transferred brinnlitz thus saved transport auschwitz train carrying woman child accidentally redirected auschwitzbirkenau schindler bribe commandant auschwitz bag diamond win release new factory schindler forbids s guard enter production room encourages jew observe shabbat jewish sabbath keep worker alive spends much fortune bribing nazi official buying shell casing company factory produce usable armament seven month operation schindler run money germany surrender ending war europe train carrying woman child accidentally redirected auschwitzbirkenau schindler bribe commandant auschwitz bag diamond win release new factory schindler forbids s guard enter production room encourages jew observe shabbat shabbat jewish sabbath keep worker alive spends much fortune bribing nazi official buying shell casing company factory produce usable armament seven month operation schindler run money germany surrender ending war europe nazi party member war profiteer schindler must flee advancing red army avoid capture s guard ordered kill jew schindler persuades return family men murderer bid farewell worker prepares head west hoping surrender american worker give schindler signed statement attesting role saving jewish life together ring engraved talmudic quotation whoever save one life save world entire schindler touched also deeply ashamed feel done even schindlerjuden schindler jew wake next morning soviet soldier announces liberated jew leave factory walk nearby town nazi party member war profiteer schindler must flee advancing red army red army avoid capture s guard ordered kill jew schindler persuades return family men murderer bid farewell worker prepares head west hoping surrender american worker give schindler signed statement attesting role saving jewish life together ring engraved talmudic talmudic quotation whoever save one life save world entire schindler touched also deeply ashamed feel done even schindlerjuden schindlerjuden schindlerjuden schindler jew wake next morning soviet soldier announces liberated jew leave factory walk nearby town scene depicting goeths execution summary schindlers later life event war blackandwhite frame change color shot actual schindlerjuden schindlers grave jerusalem accompanied actor portrayed schindlerjuden place stone grave final scene neeson place pair rose grave scene depicting goeths execution summary schindlers later life event war blackandwhite frame change color shot actual schindlerjuden schindlerjuden schindlers grave jerusalem jerusalem accompanied actor portrayed schindlerjuden schindlerjuden place stone grave final scene neeson place pair rose grave
Raging Bull,Biography  Drama  Sport,brief scene aging overweight italian american jake lamotta robert de niro practice comedy routine rest film occurs flashback lamotta major boxing match jimmy reef received first loss jakes brother joey lamotta joe pesci discusses potential shot middleweight title one mafia connection salvy batts frank vincent time thereafter jake spot yearold girl named vickie cathy moriarty openair swimming pool bronx neighborhood eventually pursues relationship even though already married jake defeat sugar ray robinson rematch three week later despite fact jake dominates robinson bout judge surprisingly rule favor robinson joey feel robinson enlisting u army following week jake marries vickie brief scene aging overweight italian american italian american jake lamotta jake lamotta robert de niro robert de niro practice comedy routine rest film occurs flashback flashback lamotta major boxing match jimmy reef received first loss jakes brother joey lamotta joey lamotta joe pesci joe pesci discusses potential shot middleweight title one mafia mafia connection salvy batts frank vincent frank vincent time thereafter jake spot yearold girl named vickie cathy moriarty cathy moriarty openair swimming pool bronx bronx neighborhood eventually pursues relationship even though already married jake defeat sugar ray robinson sugar ray robinson rematch three week later despite fact jake dominates robinson bout judge surprisingly rule favor robinson joey feel robinson enlisting u army u army following week jake marries vickie jake constantly worry vickie feeling men particularly make offhand comment tony janiro jakes opponent next fight jealousy evident brutally defeat janiro front local mob bos tommy como nicholas colasanto vickie joey discusses victory journalist copacabana distracted seeing vickie approach table salvy crew joey speaks vickie say giving brother blaming salvy joey viciously attack fight spill outside club como later order apologize joey tell jake want chance championship title como control take dive first match billy fox briefly pummeling opponent jake even bother put fight suspended shortly thereafter board suspicion throwing fight though realizes error judgment late eventually reinstated win middleweight championship title marcel cerdan jake constantly worry vickie feeling men particularly make offhand comment tony janiro tony janiro jakes opponent next fight jealousy evident brutally defeat janiro front local mob bos mob bos tommy como nicholas colasanto nicholas colasanto vickie joey discusses victory journalist copacabana copacabana distracted seeing vickie approach table salvy crew joey speaks vickie say giving brother blaming salvy joey viciously attack fight spill outside club como later order apologize joey tell jake want chance championship title como control take dive first match billy fox billy fox briefly pummeling opponent jake even bother put fight suspended shortly thereafter board suspicion throwing fight though realizes error judgment late eventually reinstated win middleweight championship title marcel cerdan marcel cerdan year later jake asks joey fought salvy copacabana vickie jake asks joey affair joey refuse answer insult jake leaf jake directly asks vickie affair hide bathroom break door prompting sarcastically state sex entire neighborhood including brother salvy tommy como jake angrily walk joeys house vickie following assault joey front wife child defending championship belt grueling fifteen round bout laurent dauthuille make call brother fight joey assumes salvy end start insulting cursing jake say nothing hang estranged joey jakes career begin decline slowly eventually loses title sugar ray robinson final encounter year later jake asks joey fought salvy copacabana vickie jake asks joey affair joey refuse answer insult jake leaf jake directly asks vickie affair hide bathroom break door prompting sarcastically state sex entire neighborhood including brother salvy tommy como jake angrily walk joeys house vickie following assault joey front wife child defending championship belt grueling fifteen round bout laurent dauthuille laurent dauthuille make call brother fight joey assumes salvy end start insulting cursing jake say nothing hang estranged joey jakes career begin decline slowly eventually loses title sugar ray robinson final encounter jake family moved miami stay night new nightclub vickie tell want divorce planning since retirement well full custody kid also threatens call cop come anywhere near later arrested introducing underage girl men club try fails bribe way criminal case using jewel championship belt instead selling belt go jail pound wall sorrowfully questioning misfortune cry despair upon returning new york city happens upon estranged brother joey forgives elusive returning opening scene jake refers coulda contender scene film waterfront starring marlon brando complaining brother also keen enough give slack stagehand informs auditorium perform crowded jake start chant im bos shadowboxing jake family moved miami miami stay night new nightclub vickie tell want divorce planning since retirement well full custody kid also threatens call cop come anywhere near later arrested introducing underage girl men club try fails bribe way criminal case using jewel championship belt instead selling belt go jail pound wall sorrowfully questioning misfortune cry despair upon returning new york city new york city happens upon estranged brother joey forgives elusive returning opening scene jake refers coulda contender scene film waterfront waterfront waterfront starring marlon brando marlon brando complaining brother also keen enough give slack stagehand informs auditorium perform crowded jake start chant im bos shadowboxing shadowboxing film cut black following biblical quote filling screen film cut black following biblical quote filling screen second time pharisee summoned man blind said speak truth god know fellow sinner whether sinner know man replied know blind see john ix new english bible second time pharisee summoned man blind said speak truth god know fellow sinner whether sinner know man replied know blind see john ix new english bible second time pharisee summoned man blind said speak truth god know fellow sinner whether sinner know man replied know blind see john ix new english bible second time pharisee pharisee summoned man blind said speak truth god know fellow sinner whether sinner know man replied know blind see john ix new english bible john ix new english bible film subsequently end onscreen dedication scorsese new york university film professor haig p manoogian film subsequently end onscreen dedication scorsese new york university new york university film professor haig p manoogian haig p manoogian remembering haig p manoogian teacher may may love resolution marty remembering haig p manoogian teacher may may love resolution marty remembering haig p manoogian teacher may may love resolution marty
