title,genre,wiki_plot_clean
Patton,Biography  Drama  War,film beginning general george patton george c scott giving speech unseen audience american troop based speech third army huge american flag background scene shift north africa start patton take charge demoralized american ii corp north africa humiliating defeat battle kasserine pas instilling discipline soldier lead victory battle el guettar though bitterly disappointed learn afterward erwin rommel karl michael vogler respect greatly general opponent pattons aide captain jenson killed battle shortly battle new member staff lieutenant colonel codman assures patton though rommel absent patton defeated rommel plan defeated rommel film beginning general george patton george patton george c scott george c scott giving speech unseen audience american troop based speech third army speech third army huge american flag background scene shift north africa north africa start patton take charge demoralized american ii corp north africa humiliating defeat battle kasserine pas battle kasserine pas instilling discipline soldier lead victory battle el guettar battle el guettar though bitterly disappointed learn afterward erwin rommel erwin rommel karl michael vogler karl michael vogler respect greatly general opponent pattons aide captain jenson killed battle shortly battle new member staff lieutenant colonel codman lieutenant colonel codman assures patton though rommel absent patton defeated rommel plan defeated rommel patton shown believe reincarnation remaining devout christian one point north africa campaign take staff unexpected detour site ancient battle zama reminisces battle insisting second command general omar bradley karl malden patton shown believe reincarnation reincarnation remaining devout christian christian one point north africa campaign take staff unexpected detour site ancient battle zama battle zama reminisces battle insisting second command general omar bradley omar bradley karl malden karl malden north africa secured patton involved allied invasion sicily proposal land seventh army northwest island rejected favor cautious plan british general bernard law montgomery british american army land sidebyside southeast frustrated slow progress campaign patton defies order racing northwest capture city palermo narrowly beat montgomery race capture port messina northeast however pattons aggression regarded increasing disquiet subordinate bradley truscott eventually relieved command slapping threatening shoot shellshocked soldier accuses cowardice army hospital north africa secured patton involved allied invasion sicily allied invasion sicily proposal land seventh army northwest island rejected favor cautious plan british british general bernard law montgomery bernard law montgomery british american army land sidebyside southeast frustrated slow progress campaign patton defies order racing northwest capture city palermo palermo narrowly beat montgomery race capture port messina messina northeast however pattons aggression regarded increasing disquiet subordinate bradley truscott eventually relieved command slapping threatening shoot shellshocked shellshocked soldier accuses cowardice army hospital incident tendency speak mind press sidelined longanticipated dday landing placed command fictional first united state army group southeast england decoy german general alfred jodl richard münch convinced patton lead invasion europe incident tendency speak mind press sidelined longanticipated dday dday landing placed command fictional first united state army group first united state army group southeast england decoy german general alfred jodl alfred jodl richard münch richard münch convinced patton lead invasion europe invasion europe fearing miss destiny begs former subordinate general omar bradley command war end given third army distinguishes rapidly sweeping across france tank halted lack fuel later relief vital town bastogne battle bulge smash siegfried line drive germany fearing miss destiny begs former subordinate general omar bradley command war end given third army third army distinguishes rapidly sweeping across france tank halted lack fuel later relief vital town bastogne bastogne battle bulge battle bulge smash siegfried line siegfried line drive germany patton previously remarked british crowd united state great britain would dominate postwar world viewed slight russian german capitulate insult russian officer celebration fortunately russian insult patton right back defusing situation patton make offhand remark comparing nazi party political party u end pattons outspokenness loses command though kept see rebuilding germany patton previously remarked british british crowd united state united state great britain great britain would dominate postwar world viewed slight russian russian german capitulate insult russian officer celebration fortunately russian insult patton right back defusing situation patton make offhand remark comparing nazi party political party u end pattons outspokenness loses command though kept see rebuilding germany film end patton walking dog bull terrier named willie scott relating voice returning hero ancient rome honored triumph victory parade slave stood behind conqueror holding golden crown whispering ear warning glory fleeting film end patton walking dog bull terrier bull terrier named willie scott relating voice voice returning hero ancient rome honored triumph triumph victory parade slave stood behind conqueror holding golden crown whispering ear warning glory fleeting
Jaws,Drama  Thriller,young woman named chrissie watkins leaf evening beach party new england amity island go skinny dipping atlantic ocean dragged back forth pulled water amity police chief martin brody notified chrissie missing deputy hendricks find remains beach medical examiner informs brody killed shark brody plan close beach overruled mayor larry vaughan fear report shark attack ruin summer tourist season town primary source income medical examiner consequently attribute death boating accident brody reluctantly go along explanation young woman named chrissie watkins leaf evening beach party new england new england amity island go skinny dipping skinny dipping atlantic ocean dragged back forth pulled water amity police chief martin brody notified chrissie missing deputy hendricks find remains beach medical examiner informs brody killed shark brody plan close beach overruled mayor larry vaughan fear report shark attack ruin summer tourist season town primary source income medical examiner consequently attribute death boating accident brody reluctantly go along explanation short time later boy killed shark beach boy mother place bounty shark sparking amateur sharkhunting frenzy attracting attention local professional shark hunter quint marine biologist matt hooper examines chrissies remains determines unquestionably killed shark boat short time later boy killed shark beach boy mother place bounty shark sparking amateur sharkhunting frenzy attracting attention local professional shark hunter quint marine biologist matt hooper examines chrissies remains determines unquestionably killed shark boat large tiger shark caught fisherman leading townspeople believe problem solved hooper unconvinced asks examine stomach content vaughan refuse make autopsy public brody hooper return dark discover dead shark contain human remains come across halfsunken wreckage boat belonging local fisherman ben gardner hooper explores vessel underwater discovers sizable shark tooth protruding damaged hull startled gardner remains vaughan refuse close beach fourth july many tourist arrive childrens practical joke cause panic main beach shark enters nearby estuary killing man brodys son witness attack go shock brody persuades vaughan hire quint reluctantly allows hooper join hunt along brody three set catch kill shark aboard quint vessel orca large tiger shark tiger shark caught fisherman leading townspeople believe problem solved hooper unconvinced asks examine stomach content vaughan refuse make autopsy public brody hooper return dark discover dead shark contain human remains come across halfsunken wreckage boat belonging local fisherman ben gardner hooper explores vessel underwater discovers sizable shark tooth protruding damaged hull hull startled gardner remains vaughan refuse close beach fourth july many tourist arrive childrens practical joke cause panic main beach shark enters nearby estuary estuary killing man brodys son witness attack go shock brody persuades vaughan hire quint reluctantly allows hooper join hunt along brody three set catch kill shark aboard quint vessel orca orca brody given task laying chum line quint us fishing tackle try hook shark enormous great white shark loom behind boat trio watch circle orca hooper take picture research quint harpoon line attached flotation barrel shark pull barrel disappears brody given task laying chum chum line quint us fishing tackle try hook shark enormous great white shark great white shark loom behind boat trio watch circle orca orca hooper take picture research quint harpoon line attached flotation barrel shark pull barrel disappears men retire boat cabin quint relates experience shark survivor sinking warship us indianapolis war pacific shark reappears damaging boat hull slipping away morning brody attempt call coast guard quint destroys radio long chase quint harpoon another barrel shark men tie stern shark drag boat backward forcing water onto deck flooding engine quint head toward shore hoping draw shallow water suffocate intent kill shark quint overtaxes stall orca engine men retire boat cabin quint relates experience shark survivor sinking warship us indianapolis us indianapolis indianapolis war pacific war pacific shark reappears damaging boat hull slipping away morning brody attempt call coast guard coast guard quint destroys radio long chase quint harpoon another barrel shark men tie stern shark drag boat backward forcing water onto deck flooding engine quint head toward shore hoping draw shallow water suffocate suffocate intent kill shark quint overtaxes stall orca orca engine boat immobilized trio attempt desperate approach hooper don scuba gear enters ocean inside shark proof cage aiming stab shark hypodermic spear filled strychnine shark attack cage hooper drop spear manages escape seabed quint brody raise mangled cage shark leap onto boat crushing transom quint slip deck shark mouth eaten alive shark attack brody shove pressurized scuba tank mouth take quint rifle climb sinking orca mast brody shoot scuba tank blowing shark piece hooper emerges two make raft orca remains paddle back amity island boat immobilized trio attempt desperate approach hooper don scuba gear scuba gear enters ocean inside shark proof cage shark proof cage aiming stab shark hypodermic spear filled strychnine strychnine shark attack cage hooper drop spear manages escape seabed quint brody raise mangled cage shark leap onto boat crushing transom transom quint slip deck shark mouth eaten alive shark attack brody shove pressurized scuba tank mouth take quint rifle climb sinking orca orca mast brody shoot scuba tank blowing shark piece hooper emerges two make raft orca orca remains paddle back amity island
Braveheart,Action  Biography  Drama  History  War,king edward longshanks patrick mcgoohan invades conquers scotland following death alexander iii scotland left heir throne young william wallace witness treachery longshanks survives death father brother taken abroad rome uncle argyle brian cox educated year later longshanks grant nobleman land privilege scotland including prima nocte right lord sex female subject wedding night return home uncle argyle presumably deceased point wallace mel gibson fall love childhood friend murron macclannough catherine mccormack marry secret spend night bed english lord wallace rescue murron raped english soldier consequence murron captured publicly executed retribution wallace slaughter english garrison sends occupying garrison lanark back england king edward longshanks king edward longshanks patrick mcgoohan patrick mcgoohan invades conquers scotland scotland following death alexander iii scotland alexander iii scotland left heir throne young william wallace witness treachery longshanks survives death father brother taken abroad rome rome uncle argyle brian cox brian cox educated year later longshanks grant nobleman land privilege scotland including prima nocte right lord sex female subject wedding night right lord sex female subject wedding night return home uncle argyle presumably deceased point wallace mel gibson mel gibson fall love childhood friend murron macclannough catherine mccormack catherine mccormack marry secret spend night bed english lord wallace rescue murron raped english soldier consequence murron captured publicly executed retribution wallace slaughter english garrison slaughter english garrison sends occupying garrison lanark lanark back england enrages longshanks order son prince edward stop wallace mean necessary wallace rebel english legend spread hundred scot surrounding clan join september wallace lead army victory stirling sacked city york killing longshanks nephew sending head back wallace seek assistance robert bruce angus macfadyen son nobleman robert elder ian bannen contender scottish crown robert dominated father wish secure throne son submitting english worried threat rebellion longshanks sends son wife isabella france sophie marceau try negotiate wallace hoping wallace kill order draw french king declare war wallace refuse bribe sent isabella longshanks meeting person isabella becomes enamored meanwhile longshanks prepares army invade scotland enrages longshanks order son prince edward prince edward stop wallace mean necessary wallace rebel english legend spread hundred scot surrounding clan join september wallace lead army victory stirling stirling sacked city york york killing longshanks nephew sending head back wallace seek assistance robert bruce robert bruce angus macfadyen angus macfadyen son nobleman robert elder robert elder ian bannen ian bannen contender scottish crown robert dominated father wish secure throne son submitting english worried threat rebellion longshanks sends son wife isabella france isabella france sophie marceau sophie marceau try negotiate wallace hoping wallace kill order draw french king declare war wallace refuse bribe sent isabella longshanks meeting person isabella becomes enamored meanwhile longshanks prepares army invade scotland warned coming invasion isabella wallace implores scottish nobility immediate action needed counter threat take back country leading english army longshanks confronts scot falkirk july nobleman lochlan mornay betray wallace scot lose battle morrison hamishs father die battle charge toward departing longshanks horseback wallace intercepted one king lancer turn robert remorseful get wallace safety english capture wallace kill mornay lochlan betrayal wage guerrilla war english next seven year assisted isabella eventually affair robert intending join wallace commit troop war set meeting edinburgh however robert father conspired noble capture hand wallace english learning treachery robert disowns father isabella exacts revenge terminally ill longshanks telling pregnant wallace child intent ending longshanks line ruling son place warned coming invasion isabella wallace implores scottish nobility immediate action needed counter threat take back country leading english army longshanks confronts scot falkirk falkirk july nobleman lochlan mornay betray wallace scot lose battle battle morrison hamishs father die battle charge toward departing longshanks horseback wallace intercepted one king lancer turn robert remorseful get wallace safety english capture wallace kill mornay lochlan betrayal wage guerrilla war english next seven year assisted isabella eventually affair robert intending join wallace commit troop war set meeting edinburgh edinburgh however robert father conspired noble capture hand wallace english learning treachery robert disowns father isabella exacts revenge terminally ill longshanks telling pregnant wallace child intent ending longshanks line ruling son place london wallace brought english magistrate tried high treason condemned public torture beheading even whilst hanged drawn quartered wallace refuse beg mercy submit king cry mercy come watching crowd deeply moved scotsman valor magistrate offer one final chance asking utter word mercy granted quick death wallace instead shout word freedom judge order death moment decapitated wallace see vision murron crowd smiling london london wallace brought english magistrate tried high treason condemned public torture beheading even whilst hanged drawn quartered hanged drawn quartered wallace refuse beg mercy submit king cry mercy come watching crowd deeply moved scotsman valor magistrate offer one final chance asking utter word mercy granted quick death wallace instead shout word freedom judge order death moment decapitated decapitated wallace see vision murron crowd smiling robert scotland king lead scottish army ceremonial line english troop field bannockburn formally accept english rule begin ride toward english stop invokes wallace memory imploring men fight wallace robert lead army battle stunned english winning scot freedom robert scotland king lead scottish army ceremonial line english troop field bannockburn bannockburn formally accept english rule begin ride toward english stop invokes wallace memory imploring men fight wallace robert lead army battle stunned english winning scot freedom
"The Good, the Bad and the Ugly",Western,section need improved plot summary june section need improved plot summary june section need improved plot summary june section need improved plot summary june section need improved plot summary plot summary june june june violet sanford piper perabo leaf hometown south amboy new jersey father bill john goodman best friend gloria melanie lynskey pursue dream becoming songwriter nearby new york city pizza shop work wall covered autograph employee left hoping make big violet add wall violet sanford piper perabo piper perabo leaf hometown south amboy new jersey south amboy new jersey father bill john goodman john goodman best friend gloria melanie lynskey melanie lynskey pursue dream becoming songwriter songwriter nearby new york city pizza shop work wall covered autograph autograph employee left hoping make big violet add wall violet try unsuccessfully dozen time get demo tape noticed recording studio one night try get noticed music industry scout bartender jokingly point kevin odonnell adam garcia making believe bar owner joke discovered violet feel kevin making fool dollar left pocket apartment robbed go allnight diner notice three girl cammie izabella miko rachel bridget moynahan zoe tyra bank flaunting hundred dollar tip earned inquiring find work trendy bar named coyote ugly violet try unsuccessfully dozen time get demo tape demo tape noticed recording studio one night try get noticed music industry scout bartender bartender jokingly point kevin odonnell adam garcia adam garcia making believe bar owner joke discovered violet feel kevin making fool dollar left pocket apartment robbed go allnight diner diner notice three girl cammie izabella miko izabella miko rachel bridget moynahan bridget moynahan zoe tyra bank tyra bank flaunting hundred dollar tip earned inquiring find work trendy bar named coyote ugly find way bar convinces bar owner lil maria bello give audition violet first audition go well breaking fight two customer lil agrees give second audition second audition violet douses fire warden water costing lil order keep job make one night kevin turn bar end auctioned one woman bar order pay debt kevin violet agrees go four date two begin relationship find way bar convinces bar owner lil maria bello maria bello give audition violet first audition go well breaking fight two customer lil agrees give second audition second audition violet douses fire warden water costing lil order keep job make one night kevin turn bar end auctioned one woman bar order pay debt kevin violet agrees go four date two begin relationship kevin commits helping violet overcome stage fright sell music discovered violet stage fright inherited mother also came new york singer also discovered violet sing song arent learn sings bar bar order save neck cammie rachel trying break fight customer kevin commits helping violet overcome stage fright sell music discovered violet stage fright inherited mother also came new york singer also discovered violet sing song arent learn sings bar bar order save neck cammie rachel trying break fight customer one night patron take picture violet middle raunchy move water pouring picture appears paper violet father happens see get angry continues pursue dream though despite sidetracked work bar get fired kevin get fight bar return jersey best friend wedding make way back new york dad car accident one night patron take picture violet middle raunchy move water pouring picture appears paper violet father happens see get angry continues pursue dream though despite sidetracked work bar get fired kevin get fight bar return jersey best friend wedding make way back new york dad car accident later performs open mic night bowery ballroom coyote coyote ugly saloon father best friend kevin moral support performance go well finally land deal record label later performs open mic night bowery ballroom bowery ballroom coyote coyote ugly saloon father best friend kevin moral support performance go well finally land deal record label film concludes back coyote ugly leann rime coyote singing violet song violet join father kevin watch audience film concludes back coyote ugly leann rime coyote singing violet song violet join father kevin watch audience
