title,genre,wiki_plot_clean
The Bridge on the River Kwai,Adventure  Drama  War,world war ii british prisoner arrive japanese prison camp western burma commandant colonel saito sessue hayakawa informs prisoner regardless rank work construction railway bridge river kwai senior british officer lieutenant colonel nicholson alec guinness reminds saito geneva convention exempt officer manual labour world war ii world war ii british prisoner arrive japanese japanese prison camp prison camp western burma burma commandant commandant colonel colonel saito sessue hayakawa sessue hayakawa informs prisoner regardless rank work construction railway bridge river kwai river kwai senior british officer lieutenant colonel nicholson alec guinness alec guinness reminds saito geneva convention geneva convention exempt officer manual labour following morning assembly nicholson order officer remain behind enlisted men sent work saito slap across face copy convention threatens shot nicholson refuse back major clipton james donald british medical officer intervenes saito leaf officer standing day intense tropical heat evening officer placed punishment hut nicholson locked iron box following morning assembly nicholson order officer remain behind enlisted men sent work saito slap across face copy convention threatens shot nicholson refuse back major major clipton james donald james donald british medical officer medical officer intervenes saito leaf officer standing day intense tropical heat evening officer placed punishment hut nicholson locked iron box meanwhile three prisoner attempt escape two shot dead united state navy commander shear william holden get away although badly wounded stumble village villager help escape boat meanwhile three prisoner attempt escape two shot dead united state navy united state navy commander commander shear william holden william holden get away although badly wounded stumble village villager help escape boat nicholson refuse compromise meanwhile prisoner working little possible sabotaging whatever saito fail meet deadline would obliged commit ritual suicide desperate saito us anniversary japan victory russojapanese war excuse save face announces general amnesty releasing nicholson officer nicholson refuse compromise meanwhile prisoner working little possible sabotaging whatever saito fail meet deadline would obliged commit ritual suicide ritual suicide desperate saito us anniversary japan victory russojapanese war russojapanese war excuse save face face announces general amnesty releasing nicholson officer nicholson conduct inspection shocked poor job done men protest officer order captain reef peter williams major hughes john boxer design build proper bridge despite military value japanese sake maintaining men morale japanese engineer chosen poor site original construction abandoned new bridge begun downstream nicholson conduct inspection shocked poor job done men protest officer order captain captain reef peter williams major major hughes john boxer john boxer design build proper bridge despite military value japanese sake maintaining men morale japanese engineer chosen poor site original construction abandoned new bridge begun downstream shear enjoying hospital stay ceylon british major warden jack hawkins asks volunteer commando mission destroy bridge completed shear appalled idea reveals officer switched uniform dead officer sinking cruiser ploy get better treatment warden already know faced prospect charged impersonating officer shear volunteer shear enjoying hospital stay ceylon british major warden jack hawkins jack hawkins asks volunteer commando mission destroy bridge completed shear appalled idea reveals officer switched uniform dead officer sinking cruiser ploy get better treatment warden already know faced prospect charged impersonating officer shear volunteer meanwhile nicholson drive men hard complete bridge time completion exemplify ingenuity hard work british army generation asks japanese counterpart join well resigned saito reply already given order meanwhile nicholson drive men hard complete bridge time completion exemplify ingenuity hard work british army british army generation asks japanese counterpart join well resigned saito reply already given order commando parachute one man killed landing later warden wounded encounter japanese patrol carried litter shear canadian lieutenant joyce geoffrey horne reach river time assistance siamese woman bearer village chief khun yai cover darkness shear joyce plant explosive bridge tower water line commando commando parachute one man killed landing later warden wounded encounter japanese patrol carried litter shear canadian canadian lieutenant joyce geoffrey horne geoffrey horne reach river time assistance siamese woman bearer village chief khun yai cover darkness shear joyce plant explosive bridge tower water line train carrying soldier important dignitary scheduled first cross bridge following day warden wait destroy however daybreak commando horrified see water level dropped exposing wire connecting explosive detonator making final inspection nicholson spot wire brings saitos attention train heard approaching hurry riverbank investigate train carrying soldier important dignitary scheduled first cross bridge following day warden wait destroy however daybreak commando horrified see water level dropped exposing wire connecting explosive detonator making final inspection nicholson spot wire brings saitos attention train heard approaching hurry riverbank investigate joyce manning detonator break cover stab saito death aghast nicholson yell help attempting stop joyce reaching detonator joyce shot dead japanese fire shear swim across river fatally wounded reach nicholson recognizing dying shear nicholson exclaims done warden fire mortar mortally wounding nicholson dazed colonel stumble towards detonator collapse plunger time blow bridge send train hurtling river witnessing carnage clipton shake head uttering madness madness joyce manning detonator break cover stab saito death aghast nicholson yell help attempting stop joyce reaching detonator joyce shot dead japanese fire shear swim across river fatally wounded reach nicholson recognizing dying shear nicholson exclaims done warden fire mortar mortar mortally wounding nicholson dazed colonel stumble towards detonator collapse plunger time blow bridge send train hurtling river witnessing carnage clipton shake head uttering madness madness
Singin' in the Rain,Comedy  Musical  Romance,lockwood popular silent film star humble root singer dancer stuntman barely tolerates vapid shallow leading lady lina lamont though studio monumental picture link romantically increase popularity lina convinced love despite don protestation otherwise lockwood popular silent film star humble root singer dancer stuntman barely tolerates vapid shallow leading lady lina lamont though studio monumental picture link romantically increase popularity lina convinced love despite don protestation otherwise premiere newest film royal rascal tell gathered crowd exaggerated version life story including motto dignity always dignity word humorously contradicted flashback showing taking wide range menial humiliating role stage film alongside best friend cosmo brown premiere newest film royal rascal royal rascal tell gathered crowd exaggerated version life story including motto dignity always dignity word humorously contradicted flashback flashback showing taking wide range menial humiliating role stage film alongside best friend cosmo brown escape fan premiere jump passing car driven kathy selden drop claiming stage actress sneering undignified accomplishment later party head don studio rf simpson show short demonstration vitaphone talking picture guest unimpressed don amusement kathys embarrassment pop mock cake right front part entertainment kathy turn chorus girl furious don teasing throw real cake hit lina right face smitten run night search week discovering fired believing responsible lina tell filming love scene made sure kathy lost job act revenge jealousy later find kathy working another monumental picture production apologize confesses fan along begin fall love escape fan premiere jump passing car driven kathy selden drop claiming stage actress sneering undignified accomplishment later party head don studio rf simpson show short demonstration vitaphone vitaphone talking picture talking picture guest unimpressed don amusement kathys embarrassment pop mock cake right front part entertainment kathy turn chorus girl furious don teasing throw real cake hit lina right face smitten run night search week discovering fired believing responsible lina tell filming love scene made sure kathy lost job act revenge jealousy later find kathy working another monumental picture production apologize confesses fan along begin fall love rival studio enormous hit first talking picture jazz singer rf decides choice convert next lockwood lamont film dueling cavalier talkie production beset difficulty capturing sound far worst problem linas grating voice exasperated diction coach try teach speak properly avail also take diction lesson albeit much better result dueling cavalier test screening disaster actor speaking barely audible thanks awkward placing microphone repeat line love lina audience derisive laughter middle film sound go synchronization hilarious result rival studio enormous hit first talking picture jazz singer jazz singer jazz singer rf decides choice convert next lockwood lamont film dueling cavalier dueling cavalier talkie production beset difficulty capturing sound far worst problem linas grating voice exasperated diction coach try teach speak properly avail also take diction lesson albeit much better result dueling cavalier dueling cavalier test screening disaster actor speaking barely audible thanks awkward placing microphone repeat line love lina audience derisive laughter middle film sound go synchronization hilarious result premiere kathy cosmo come idea turn dueling cavalier musical called dancing cavalier complete modern musical number called broadway melody able show natural singing dancing talent stumped must think lina cosmo inspired scene dueling cavalier linas voice sync suggests dub linas voice kathys bring idea rf go ahead lina find infuriated becomes even angrier discovers rf intends give kathy screen credit big publicity promotion lina consulting lawyer threatens sue rf unless cancel kathys buildup order continue working uncredited linas voice rf reluctantly agrees demand premiere kathy cosmo come idea turn dueling cavalier dueling cavalier musical called dancing cavalier dancing cavalier complete modern musical number called broadway melody able show natural singing dancing talent stumped must think lina cosmo inspired scene dueling cavalier linas voice sync suggests dub linas voice kathys bring idea rf go ahead lina find infuriated becomes even angrier discovers rf intends give kathy screen credit big publicity promotion lina consulting lawyer threatens sue rf unless cancel kathys buildup order continue working uncredited linas voice rf reluctantly agrees demand premiere dancing cavalier tremendous success audience clamor lina sing live cosmo rf improvise get lip sync microphone kathy hidden behind stage curtain sings second one lina singing cosmo rf gleefully raise curtain cosmo replaces kathy microphone sham becomes obvious embarrassed lina flees humiliation distressed kathy try run away well proudly announces audience shes real star film final shot show kathy kissing front billboard new film singin rain premiere dancing cavalier dancing cavalier tremendous success audience clamor lina sing live cosmo rf improvise get lip sync lip sync microphone kathy hidden behind stage curtain sings second one lina singing cosmo rf gleefully raise curtain cosmo replaces kathy microphone sham becomes obvious embarrassed lina flees humiliation distressed kathy try run away well proudly announces audience shes real star film final shot show kathy kissing front billboard new film singin rain singin rain
It's a Wonderful Life,Drama  Family  Fantasy,donna reed mary bailey james stewart playing george bailey donna reed mary bailey james stewart playing george bailey donna reed mary bailey james stewart playing george bailey donna reed donna reed mary bailey james stewart james stewart playing george bailey bedford fall new yorkn christmas eve george bailey deeply troubled suicidal prayer wellbeing friend family reach heaven clarence odbody angel nd class assigned visit earth save george thereby earning wing god father st joseph review george life clarence bedford fall bedford fall new york new york n n n christmas eve george bailey deeply troubled suicidal prayer wellbeing friend family reach heaven clarence odbody angel nd class assigned visit earth save george thereby earning wing god father st joseph review george life clarence yearold boy george saved life younger brother harry fallen ice frozen pond heroic action george lost hearing left ear later working local pharmacy george noticed druggist mr gower despondent receiving telegram son died influenza mistakenly filled child prescription poison george stopped gower saved killing child irrevocably ruining life yearold boy george saved life younger brother harry fallen ice frozen pond heroic action george lost hearing left ear later working local pharmacy pharmacy george noticed druggist mr gower despondent receiving telegram son died influenza mistakenly filled child prescription poison george stopped gower saved killing child irrevocably ruining life george grows dream travelling world wait harry graduate high school replace bailey building loan association vital townspeople harrys graduation night george preparing travel attending college discusses future mary hatch long crush later evening george absentminded uncle billy interrupt tell george father stroke prof fatal george grows dream travelling world wait harry graduate high school high school replace bailey building loan association building loan association vital townspeople harrys graduation night george preparing travel attending college discusses future mary hatch long crush crush later evening george absentminded absentminded uncle billy interrupt tell george father stroke stroke prof fatal george give summer travel plan stay bedford fall sort firm affair month later mr henry f potter rapacious slumlord member building loan association board try persuade board director dissolve building loan main objection providing home loan working poor george talk rejecting potter proposal agree condition george run building loan giving college money harry george delay plan understanding younger brother harry take upon graduation george give summer travel plan stay bedford fall sort firm affair month later mr henry f potter mr henry f potter rapacious slumlord slumlord member building loan association board try persuade board director dissolve building loan main objection providing home loan working poor george talk rejecting potter proposal agree condition george run building loan giving college money harry george delay plan understanding younger brother harry take upon graduation harry graduate college unexpectedly brings home wife whose father offered harry excellent job although harry vow decline offer respect brother george deny harry fine opportunity decides keep running building loan knowing kill dream travel world harry graduate college unexpectedly brings home wife whose father offered harry excellent job although harry vow decline offer respect brother george deny harry fine opportunity decides keep running building loan knowing kill dream travel world george call mary recently returned home college several argument reveal love marry soon depart honeymoon witness run bank leaf building loan danger collapse couple quell panic using set aside honeymoon satisfy depositor immediate need mary enlists help george two best friend bert policeman ernie cab driver create faux tropical setting substitute honeymoon newlywed couple embrace bert ernie sing background george call mary recently returned home college several argument reveal love marry soon depart honeymoon witness run bank run bank leaf building loan danger collapse collapse couple quell panic using set aside honeymoon satisfy depositor immediate need mary enlists help george two best friend bert policeman ernie cab driver create faux tropical setting substitute honeymoon newlywed couple embrace bert ernie sing background george never manages leave bedford fall start bailey park affordable housing project interest compromised potter try hire away offering salaryn along promise business trip europe something george always wanted george initially tempted turn potter realizing potter intends close building loan take full control bedford fall mary raise four child pete janie tommy zuzu george never manages leave bedford fall start bailey park affordable housing affordable housing project interest compromised potter try hire away offering salary n n n along promise business trip europe something george always wanted george initially tempted turn potter realizing potter intends close building loan take full control bedford fall mary raise four child pete janie tommy zuzu world war ii erupts george unable enlist bad ear harry becomes navy fighter pilot shoot enemy plane two targeting ship full troop pacific bravery harry awarded medal honor world war ii world war ii erupts george unable enlist unable enlist bad ear harry becomes navy navy fighter pilot shoot enemy plane two targeting ship full troop pacific bravery harry awarded medal honor medal honor christmas eve morning town prepares hero welcome harry uncle billy way potter bank deposit building loan cash fund greets potter newspaper reporting harrys heroic taunt reading headline aloud potter angrily snatch paper billy inattentively allows money snatched potter open paper notice money keep knowing misplacement bank money would result bankruptcy building loan criminal charge george uncle billy cant remember happened money bank examiner present george frantically search town turn nothing george devastated apparently destined face scandal jail take anger frustration family christmas eve morning town prepares hero welcome harry uncle billy way potter bank deposit building loan cash fund greets potter newspaper reporting harrys heroic taunt reading headline aloud potter angrily snatch paper billy inattentively allows money snatched potter open paper notice money keep knowing misplacement bank money would result bankruptcy bankruptcy building loan criminal charge george uncle billy cant remember happened money bank examiner present george frantically search town turn nothing george devastated apparently destined face scandal jail take anger frustration family george guardian angel clarence henry travers george guardian angel clarence henry travers george guardian angel clarence henry travers george guardian angel clarence henry travers henry travers desperate george appeal potter loan potter sarcastically turn george swears warrant arrest bank fraud george completely depressed get drunk bar owned friend giuseppe martini silently prays help crashing car tree george stagger bridge intending commit suicide feeling worth dead alive life insurance policy leap clarence jump first pretend drowning george rescue clarence reveals george guardian angel desperate george appeal potter loan potter sarcastically turn george swears warrant arrest bank fraud bank fraud george completely depressed get drunk bar owned friend giuseppe martini silently prays help crashing car tree george stagger bridge intending commit suicide feeling worth dead alive life insurance policy leap clarence jump first pretend drowning george rescue clarence reveals george guardian angel guardian angel george believe bitterly wish never born inspired comment clarence show george town would like without alternate scenario bedford fall instead named pottersville home sleazy nightclub pawn shop immoral people bailey park never built remains old cemetery george notice hear left ear lip bleeding clothes dry zuzus flower petal never existed alternate reality george believe bitterly wish never born inspired comment clarence show george town would like without alternate scenario bedford fall instead named pottersville home sleazy nightclub nightclub pawn shop pawn shop immoral people bailey park never built remains old cemetery cemetery george notice hear left ear lip bleeding clothes dry zuzus flower petal never existed alternate reality mr gower sent prison poisoning child despised homeless martini bar martini bartender nick owns bar run reckless manner george friend violet bick taxidancer arrested george pass location building loan location dance hall violet work ernie helplessly poor family forsaken uncle billy insane asylum many year since lost brother family business harry dead result george save drowning serviceman would saved also died george mother bitter widow mary shy single spinster librarian clarence explains george singlehandedly prevented dire fate alone kept potter check preventing town descending squalor vice mr gower sent prison poisoning child despised homeless martini bar martini bartender nick owns bar run reckless manner george friend violet bick taxidancer taxidancer arrested george pass location building loan location dance hall violet work ernie helplessly poor family forsaken uncle billy insane asylum insane asylum many year since lost brother family business harry dead result george save drowning serviceman would saved also died george mother bitter widow mary shy single spinster spinster librarian clarence explains george singlehandedly prevented dire fate alone kept potter check preventing town descending squalor vice george run back bridge begs allowed live prayer answered run home joyously authority waiting arrest mary uncle billy flood townspeople arrive enough donation save george building loan george friend sam wainwright sends line credit telegram george run back bridge begs allowed live prayer answered run home joyously authority waiting arrest mary uncle billy flood townspeople arrive enough donation save george building loan george friend sam wainwright sends line credit telegram telegram harry also arrives support brother toast george richest man town pile donated fund george find copy adventure tom sawyer inscribed dear george remember man failure friend p thanks wing love clarence bell christmas tree ring daughter zuzu remembers aloud mean angel earned wing george realizes truly wonderful life harry also arrives support brother toast george richest man town pile donated fund george find copy adventure tom sawyer adventure tom sawyer adventure tom sawyer inscribed dear george remember man failure friend p thanks wing love clarence dear george remember man failure friend p thanks wing love clarence bell christmas tree ring daughter zuzu remembers aloud mean angel earned wing george realizes truly wonderful life
