title,genre,wiki_plot_clean
Out of Africa,Biography  Drama  Romance,story begin denmark karen dinesen wealthy unmarried woman asks friend baron bror blixen klaus maria brandauer enter marriage convenience although bror member aristocracy longer financially secure therefore agrees marriage two plan move africa begin dairy farm story begin denmark denmark karen dinesen wealthy unmarried woman asks friend baron bror blixen bror blixen klaus maria brandauer klaus maria brandauer enter marriage convenience although bror member aristocracy aristocracy longer financially secure therefore agrees marriage two plan move africa africa begin dairy farm upon moving british east africa karen marries bror brief ceremony thus becoming baroness blixen meet befriends various colonial resident country british also meet denys finch hatton robert redford local biggame hunter develops close friendship however thing turn differently anticipated since bror used money purchase coffee plantation rather dairy farm also show little inclination put real work preferring instead become game hunter although marriage convenience karen eventually develop feeling bror distressed learns extramarital affair make matter worse karen contract syphilis philandering husband time cure uncertain forced return denmark long difficult period treatment using thennew medicine salvarsan bror agrees look plantation absence upon moving british east africa british east africa karen marries bror brief ceremony thus becoming baroness blixen meet befriends various colonial resident country british also meet denys finch hatton denys finch hatton robert redford robert redford local biggame hunter biggame hunter develops close friendship however thing turn differently anticipated since bror used money purchase coffee plantation rather dairy farm also show little inclination put real work preferring instead become game hunter although marriage convenience karen eventually develop feeling bror distressed learns extramarital affair make matter worse karen contract syphilis syphilis philandering husband time cure uncertain forced return denmark long difficult period treatment using thennew medicine salvarsan salvarsan bror agrees look plantation absence recovered return africa first world war drawing end however becomes clear marriage womanizing bror changed eventually asks move house longer able child due effect syphilis decides open school teach reading writing arithmetic also european custom african tribal child area however coffee plantation run financial difficulty forced rely bank loan make end meet friendship denys finch hatton develops recovered return africa first world war first world war drawing end however becomes clear marriage womanizing bror changed eventually asks move house longer able child due effect syphilis decides open school teach reading writing arithmetic also european custom african tribal child area however coffee plantation run financial difficulty forced rely bank loan make end meet friendship denys finch hatton develops despite expectation desire begin affair turn lasting relationship karen realizes denys impossible domesticate wild animal hunt often refers although move karen house criticizes desire thing implies even people refuse commit marriage give free lifestyle tell love piece paper karen grudgingly continues relationship knowing ever official decides invite female mutual acquaintance one safari exceeds karen ability tolerate justification lifestyle behavior karen asks accede request take along refuse asks move plantation finally yield good harvest long last devastating fire break processing shed crop factory equipment destroyed despite expectation desire begin affair turn lasting relationship karen realizes denys impossible domesticate wild animal hunt often refers although move karen house criticizes desire thing implies even people refuse commit marriage give free lifestyle tell love piece paper karen grudgingly continues relationship knowing ever official decides invite female mutual acquaintance one safari exceeds karen ability tolerate justification lifestyle behavior karen asks accede request take along refuse asks move plantation finally yield good harvest long last devastating fire break processing shed crop factory equipment destroyed financially broke relationship denys karen prepares leave africa return home denmark british east africa becoming kenya colony arranges sell everything owns empty house luxurious item rummage sale empty house denys visit night two enjoy drink dance asks may escort mombasa biplane begin journey home agrees promise return day however denys never return karen told plane crashed killed loss complete karen attends funeral ngong hill denys gone karen head servant farah take station train mombasa financially broke relationship denys karen prepares leave africa return home denmark british east africa becoming kenya colony kenya colony arranges sell everything owns empty house luxurious item rummage sale rummage sale empty house denys visit night two enjoy drink dance asks may escort mombasa mombasa biplane biplane begin journey home agrees promise return day however denys never return karen told plane crashed killed loss complete karen attends funeral ngong hill ngong hill denys gone karen head servant farah take station train mombasa karen later became author storyteller writing experience letter africa though never returned karen later became author storyteller writing experience letter africa though never returned
Good Will Hunting,Drama,twentyyearold hunting damon south boston selftaught geniuslevel intellect eidetic memory though work simply janitor massachusetts institute technology spends free time drinking friend chuckie affleck billy cole hauser morgan casey affleck professor gerald lambeau skarsgård post difficult problem taken algebraic graph theory challenge graduate student solves problem anonymously stunning graduate student lambeau challenge unknown genius lambeau post even difficult problem chance upon solving fearing lose sole mean meager income flees skip going work next day night meet skylar driver british orphan graduate harvard plan attending medical school stanford twentyyearold hunting damon south boston south boston selftaught geniuslevel intellect eidetic memory eidetic memory though work simply janitor massachusetts institute technology massachusetts institute technology spends free time drinking friend chuckie affleck billy cole hauser cole hauser morgan casey affleck casey affleck professor gerald lambeau skarsgård post difficult problem taken algebraic graph theory algebraic graph theory challenge graduate student solves problem anonymously stunning graduate student lambeau challenge unknown genius lambeau post even difficult problem chance upon solving fearing lose sole mean meager income flees skip going work next day night meet skylar driver british orphan graduate harvard harvard plan attending medical school stanford stanford assaulting man bullied child police officer attempt break fight face incarceration lambeau arranges forgo jail time agrees study mathematics lambeaus supervision simultaneously seeking psychotherapy tentatively agrees treat first therapist contempt refusal open met staunch defiance bourgeois mentality therapist refuse treat desperation lambeau call dr sean maguire williams estranged much grounded college roommate teach psychology bunker hill community college unlike therapist sean actually challenge will weak defense mechanism unproductive session begin open assaulting man bullied child police officer attempt break fight face incarceration lambeau arranges forgo jail time agrees study mathematics lambeaus supervision simultaneously seeking psychotherapy psychotherapy tentatively agrees treat first therapist contempt refusal open met staunch defiance bourgeois bourgeois mentality therapist refuse treat desperation lambeau call dr sean maguire williams estranged much grounded college roommate teach psychology bunker hill community college bunker hill community college unlike therapist sean actually challenge will weak defense mechanism unproductive session begin open particularly struck seans story met wife giving ticket historic sixth game world series falling love first sight sean neither regret decision regret final year marriage wife dying cancer encourages build relationship skylar though lie past reluctant introduce friend show rundown neighborhood also challenge sean take objective look life since sean unable move wife death particularly struck seans story met wife giving ticket historic sixth game world series world series falling love first sight sean neither regret decision regret final year marriage wife dying cancer encourages build relationship skylar though lie past reluctant introduce friend show rundown neighborhood also challenge sean take objective look life since sean unable move wife death chafing lambeaus high expectation make mockery job interview lambeau arranges skylar asks move california panic push away revealing orphan foster father physically abused skylar tell love denies loving leaf next storm lambeau dismissing mathematical research sean point adept anticipating future failure interpersonal relationship deliberately sabotage order avoid emotional pain refuse give honest reply want life sean show door tell chuckie want laborer rest life chuckie responds would insult friend waste potential fondest wish leave pursue something greater chafing lambeaus high expectation make mockery job interview lambeau arranges skylar asks move california panic push away revealing orphan foster father physically abused skylar tell love denies loving leaf next storm lambeau dismissing mathematical research sean point adept anticipating future failure interpersonal relationship deliberately sabotage order avoid emotional pain refuse give honest reply want life sean show door tell chuckie want laborer rest life chuckie responds would insult friend waste potential fondest wish leave pursue something greater walk heated argument sean lambeau future sean share victim child abuse sean help see victim inner demon accept fault decides accept one job offer arranged lambeau helped overcome problem sean reconciles lambeau decides take sabbatical travel world will friend present rebuilt chevrolet nova twentyfirst birthday decides pas job offer drive california reunite skylar sometime later chuckie go will house pick find sean come house find letter mailbox tell going see skylar much pleasure final scene drive away sunset walk heated argument sean lambeau future sean share victim child abuse sean help see victim inner demon accept fault decides accept one job offer arranged lambeau helped overcome problem sean reconciles lambeau decides take sabbatical travel world will friend present rebuilt chevrolet nova chevrolet nova twentyfirst birthday decides pas job offer drive california reunite skylar sometime later chuckie go will house pick find sean come house find letter mailbox tell going see skylar much pleasure final scene drive away sunset
Terms of Endearment,Comedy  Drama,aurora greenway shirley maclaine daughter emma debra winger searching deep romantic love beginning emmas early childhood aurora reveals difficult caring nearly climbing emmas crib order make sure daughter breathing reassured emma start cry woken death aurora husband emmas father rudyard brook aurora emma develop extremely close lovehate motherdaughter relationship emma grows aurora greenway shirley maclaine shirley maclaine daughter emma debra winger debra winger searching deep romantic love beginning emmas early childhood aurora reveals difficult caring nearly climbing emmas crib order make sure daughter breathing reassured emma start cry woken death aurora husband emmas father rudyard brook brook aurora emma develop extremely close lovehate motherdaughter relationship emma grows story follows woman several year seek way finding joy emma get married immediately upon graduated high school houston area flap horton jeff daniel aurora disapproves refuse attend wedding emmas best friend patsy clark lisa hart caroll continues college eventually becoming successful rich new york city story follows woman several year seek way finding joy emma get married immediately upon graduated high school houston houston area flap horton jeff daniel jeff daniel aurora disapproves refuse attend wedding emmas best friend patsy clark lisa hart caroll continues college eventually becoming successful rich new york city new york city emma two child flap becomes college professor de moines iowa separating family hundred mile emmas meddlesome mother later telephone ask mother money pregnant third child aurora knowing telephone call emma already several month pregnancy want emma get abortion emmas oncepassionate marriage flap becomes strained thanks mostly philandering eventually secret romantic affair married smalltown older banker sam burn john lithgow emma two child flap becomes college professor de moines de moines iowa iowa separating family hundred mile emmas meddlesome mother later telephone ask mother money pregnant third child aurora knowing telephone call emma already several month pregnancy want emma get abortion emmas oncepassionate marriage flap becomes strained thanks mostly philandering eventually secret romantic affair married smalltown older banker sam burn john lithgow john lithgow time aurora remains celibate cultivates attention several gentleman area rather bizarre however attracted nextdoor neighbor year womanizing alcoholic retired astronaut garrett breedlove jack nicholson aurora garrett eventually go lunch date make love develop tenuous relationship time aurora remains celibate cultivates attention several gentleman area rather bizarre however attracted nextdoor neighbor year womanizing alcoholic retired astronaut garrett breedlove jack nicholson jack nicholson aurora garrett eventually go lunch date make love develop tenuous relationship emma return mother home houston discovering husband affair young grad student named janice kate charleson emmas appearance along three child make garrett uncomfortable single long time flap telephone reluctantly return home iowa trying reconciliation unwilling become onewoman man garrett break aurora making feel humiliated emma return mother home houston discovering husband affair young grad student named janice kate charleson emmas appearance along three child make garrett uncomfortable single long time flap telephone reluctantly return home iowa trying reconciliation unwilling become onewoman man garrett break aurora making feel humiliated emma end relationship sam soon flap accepts new teaching position kearney nebraska although want emma agrees relocate flap career soon discovers janice attending college flap work realizing flap followed nebraska emma angrily confronts janice taking daughter melanie doctor office get flu shot administering injection emmas doctor notice two large lump emmas armpit although emma doctor order biopsy discovers malignancy emma end relationship sam soon flap accepts new teaching position kearney kearney nebraska nebraska although want emma agrees relocate flap career soon discovers janice attending college flap work realizing flap followed nebraska emma angrily confronts janice taking daughter melanie doctor office get flu shot administering injection emmas doctor notice two large lump emmas armpit although emma doctor order biopsy discovers malignancy cheer patsy invite emma new york city first vacation without child however arriving emma feel outofplace amongst patsy friend return home early begin treatment illness doctor break news drug taking desired effect emma survive illness flap aurora remain bedside hospital week although devastated exhausted aurora still supportive loving towards emma garrett fly lincoln nebraska surprise aurora confesses love issue stock reply love kid cheer patsy invite emma new york city first vacation without child however arriving emma feel outofplace amongst patsy friend return home early begin treatment illness doctor break news drug taking desired effect emma survive illness flap aurora remain bedside hospital week although devastated exhausted aurora still supportive loving towards emma garrett fly lincoln lincoln nebraska nebraska surprise aurora confesses love issue stock reply love kid discussion hospital cafeteria aurora tell flap bluntly energy job chasing woman managing family advising let raise emmas child houston patsy child want adopt melanie flap emma want kid separated emma also doesnt want janice raise child flap feeling like failure father husband agrees live aurora best discussion hospital cafeteria aurora tell flap bluntly energy job chasing woman managing family advising let raise emmas child houston patsy child want adopt melanie flap emma want kid separated emma also doesnt want janice raise child flap feeling like failure father husband agrees live aurora best emmas time begin run short eldest son tommy troy bishop show open resentment toward mother due circumstance social class fight parent tommys perception feeling unloved emma reassures two son altercation aurora slap hospital parking lot criticizing mother tommy weeps grandmother arm emma dy later night emmas time begin run short eldest son tommy troy bishop show open resentment toward mother due circumstance social class fight parent tommys perception feeling unloved emma reassures two son altercation aurora slap hospital parking lot criticizing mother tommy weeps grandmother arm emma dy later night following funeral emmas friend family gather aurora backyard memorial service garrett show affection toward emmas child help tommy cope wake film close aurora sitting next melanie following funeral emmas friend family gather aurora backyard memorial service garrett show affection toward emmas child help tommy cope wake film close aurora sitting next melanie
Tootsie,Comedy  Drama  Romance,michael dorsey dustin hoffman respected perfectionist actor nobody new york want hire anymore difficult work according longsuffering agent george field sydney pollack michael attention detail difficult reputation led commercial worked run significantly overschedule idea tomato sitting illogical many month without job michael hears opening soap opera southwest general friend acting student sandy lester teri garr try role hospital administrator emily kimberly get desperation result agent telling one hire dress woman audition dorothy michael win part michael take job way raise produce play written roommate jeff slater bill murray titled return love canal michael play character feisty feminist administrator surprise actor crew expected emily written another swooning female plot character quickly becomes television sensation michael dorsey dustin hoffman dustin hoffman respected perfectionist perfectionist actor nobody new york new york want hire anymore difficult work according longsuffering agent george field sydney pollack sydney pollack michael attention detail difficult reputation led commercial worked run significantly overschedule idea tomato sitting illogical many month without job michael hears opening soap opera soap opera southwest general southwest general friend acting student sandy lester teri garr teri garr try role hospital administrator emily kimberly get desperation result agent telling one hire dress woman audition dorothy michael win part michael take job way raise produce play written roommate jeff slater bill murray bill murray titled return love canal return love canal love canal michael play character feisty feminist administrator surprise actor crew expected emily written another swooning female plot character quickly becomes television sensation sandy catch michael bedroom half undressed wanted try clothes order get idea dorothys outfit cover professing want sex sex despite better judgment selfesteem issue michael belief sandy emotionally fragile handle truth winning part especially noticing strong resentment dorothy relationship combined deception complicates nowbusy schedule exacerbating matter strongly attracted one costars lovely softspoken julie nichols jessica lange single mother unhealthy relationship show amoral sexist director ron carlisle dabney coleman party michael approach julie pickup line previously told dorothy would receptive towards throw drink face later dorothy make tentative advance julie ended relationship ron per dorothys advice confesses feeling dorothy confuse emotionally ready romantic relationship woman sandy catch michael bedroom half undressed wanted try clothes order get idea dorothys outfit cover professing want sex sex despite better judgment selfesteem issue michael belief sandy emotionally fragile handle truth winning part especially noticing strong resentment dorothy relationship combined deception complicates nowbusy schedule exacerbating matter strongly attracted one costars lovely softspoken julie nichols jessica lange jessica lange single mother unhealthy relationship show amoral sexist director ron carlisle dabney coleman dabney coleman party michael approach julie pickup line previously told dorothy would receptive towards throw drink face later dorothy make tentative advance julie ended relationship ron per dorothys advice confesses feeling dorothy confuse emotionally ready romantic relationship woman meanwhile dorothy admirer contend older cast member john van horn george gaynes july widowed father le charles durning le proposes marriage insisting michaeldorothy think answering leaf immediately return home find costar john almost force dorothy jeff walk john apologizes intruding leaf tipping point come due dorothys popularity show producer want extend contract another year michael find clever way extricate cast forced perform show live improvises grand speech camera pull wig reveals actually character twin brother took place avenge sandy le jeff watching home react level shock cast crew show exception jeff simply remark thatis one nutty hospital revelation allows everybody moreorless graceful way julie however outraged slug stomach offcamera week later michael moving forward producing jeffs play awkwardly make peace le bar le show tentative support michael attraction julie later michael wait julie outside studio julie resists talking finally admits miss dorothy michael confesses better man woman ever woman man forgives walk julie asking lend dress meanwhile dorothy admirer contend older cast member john van horn george gaynes george gaynes july widowed father le charles durning charles durning le proposes marriage insisting michaeldorothy think answering leaf immediately return home find costar john almost force dorothy jeff walk john apologizes intruding leaf tipping point come due dorothys popularity show producer want extend contract another year michael find clever way extricate cast forced perform show live improvises grand speech camera pull wig reveals actually character twin brother took place avenge sandy le jeff watching home react level shock cast crew show exception jeff simply remark thatis one nutty hospital revelation allows everybody moreorless graceful way julie however outraged slug stomach offcamera week later michael moving forward producing jeffs play awkwardly make peace le bar le show tentative support michael attraction julie later michael wait julie outside studio julie resists talking finally admits miss dorothy michael confesses better man woman ever woman man forgives walk julie asking lend dress
